{
  "as_of": "2026-10-08",
  "assessment_id": "readiness-cc2079e965e0e670c2411c6ca5b4c6fa6b91beddb3dbcd2e44ca6c7495182234",
  "benchmark_candidates": [
    {
      "admission_status": "blocked",
      "blockers": [
        "R-017 covers pinned public metadata only; no direct string match does not establish independence",
        "R-017 identifies 18 nearby benchmark witnesses in this institutional collection",
        "all-source benchmark accession/edition/near-duplicate quarantine",
        "approved acquisition channel, actual image bytes, image hashes, faces and writing IDs",
        "candidate roster is metadata-only and does not grant use or acquisition permission",
        "diplomatic/transliteration/editorial-text rights are not verified",
        "exact institutional image bytes and original hash have not been verified",
        "independent expert line/sign/transliteration gold and uncertainty",
        "independent expert-reviewed line/sign gold is unavailable",
        "independent rights and intended use for each actual image and editorial text/annotation",
        "institutional alias, joined-fragment, edition, image-hash and perceptual-duplicate reviews remain pending",
        "leakage-resistant nonempty real train/dev/test partitions",
        "object, manuscript, fragment, side and exposure lineage is incomplete"
      ],
      "candidate_id": "TPOP-1896",
      "exact_public_source_metadata_match_count": 0,
      "image_equivalence_status": "NOT_TESTED",
      "nearby_collection_witness_count": 18,
      "overlap_state": "potential_overlap",
      "rights_status": "NOT_CLEARED",
      "source_lineage_status": "NO_DIRECT_METADATA_MATCH__ALIAS_IMAGE_EDITION_REVIEW_PENDING"
    },
    {
      "admission_status": "blocked",
      "blockers": [
        "R-017 covers pinned public metadata only; no direct string match does not establish independence",
        "R-017 identifies 18 nearby benchmark witnesses in this institutional collection",
        "all-source benchmark accession/edition/near-duplicate quarantine",
        "approved acquisition channel, actual image bytes, image hashes, faces and writing IDs",
        "candidate roster is metadata-only and does not grant use or acquisition permission",
        "diplomatic/transliteration/editorial-text rights are not verified",
        "exact institutional image bytes and original hash have not been verified",
        "independent expert line/sign/transliteration gold and uncertainty",
        "independent expert-reviewed line/sign gold is unavailable",
        "independent rights and intended use for each actual image and editorial text/annotation",
        "institutional alias, joined-fragment, edition, image-hash and perceptual-duplicate reviews remain pending",
        "leakage-resistant nonempty real train/dev/test partitions",
        "object, manuscript, fragment, side and exposure lineage is incomplete"
      ],
      "candidate_id": "TPOP-1971",
      "exact_public_source_metadata_match_count": 0,
      "image_equivalence_status": "NOT_TESTED",
      "nearby_collection_witness_count": 18,
      "overlap_state": "potential_overlap",
      "rights_status": "NOT_CLEARED",
      "source_lineage_status": "NO_DIRECT_METADATA_MATCH__ALIAS_IMAGE_EDITION_REVIEW_PENDING"
    },
    {
      "admission_status": "blocked",
      "blockers": [
        "R-017 covers pinned public metadata only; no direct string match does not establish independence",
        "R-017 identifies 18 nearby benchmark witnesses in this institutional collection",
        "all-source benchmark accession/edition/near-duplicate quarantine",
        "approved acquisition channel, actual image bytes, image hashes, faces and writing IDs",
        "candidate roster is metadata-only and does not grant use or acquisition permission",
        "diplomatic/transliteration/editorial-text rights are not verified",
        "exact institutional image bytes and original hash have not been verified",
        "independent expert line/sign/transliteration gold and uncertainty",
        "independent expert-reviewed line/sign gold is unavailable",
        "independent rights and intended use for each actual image and editorial text/annotation",
        "institutional alias, joined-fragment, edition, image-hash and perceptual-duplicate reviews remain pending",
        "leakage-resistant nonempty real train/dev/test partitions",
        "object, manuscript, fragment, side and exposure lineage is incomplete"
      ],
      "candidate_id": "TPOP-1966",
      "exact_public_source_metadata_match_count": 0,
      "image_equivalence_status": "NOT_TESTED",
      "nearby_collection_witness_count": 18,
      "overlap_state": "potential_overlap",
      "rights_status": "NOT_CLEARED",
      "source_lineage_status": "NO_DIRECT_METADATA_MATCH__ALIAS_IMAGE_EDITION_REVIEW_PENDING"
    },
    {
      "admission_status": "blocked",
      "blockers": [
        "R-017 covers pinned public metadata only; no direct string match does not establish independence",
        "R-017 identifies 18 nearby benchmark witnesses in this institutional collection",
        "all-source benchmark accession/edition/near-duplicate quarantine",
        "approved acquisition channel, actual image bytes, image hashes, faces and writing IDs",
        "candidate roster is metadata-only and does not grant use or acquisition permission",
        "diplomatic/transliteration/editorial-text rights are not verified",
        "exact institutional image bytes and original hash have not been verified",
        "independent expert line/sign/transliteration gold and uncertainty",
        "independent expert-reviewed line/sign gold is unavailable",
        "independent rights and intended use for each actual image and editorial text/annotation",
        "institutional alias, joined-fragment, edition, image-hash and perceptual-duplicate reviews remain pending",
        "leakage-resistant nonempty real train/dev/test partitions",
        "object, manuscript, fragment, side and exposure lineage is incomplete"
      ],
      "candidate_id": "TPOP-2021",
      "exact_public_source_metadata_match_count": 0,
      "image_equivalence_status": "NOT_TESTED",
      "nearby_collection_witness_count": 18,
      "overlap_state": "potential_overlap",
      "rights_status": "NOT_CLEARED",
      "source_lineage_status": "NO_DIRECT_METADATA_MATCH__ALIAS_IMAGE_EDITION_REVIEW_PENDING"
    },
    {
      "admission_status": "blocked",
      "blockers": [
        "R-017 covers pinned public metadata only; no direct string match does not establish independence",
        "R-017 identifies 18 nearby benchmark witnesses in this institutional collection",
        "all-source benchmark accession/edition/near-duplicate quarantine",
        "approved acquisition channel, actual image bytes, image hashes, faces and writing IDs",
        "candidate roster is metadata-only and does not grant use or acquisition permission",
        "diplomatic/transliteration/editorial-text rights are not verified",
        "exact institutional image bytes and original hash have not been verified",
        "independent expert line/sign/transliteration gold and uncertainty",
        "independent expert-reviewed line/sign gold is unavailable",
        "independent rights and intended use for each actual image and editorial text/annotation",
        "institutional alias, joined-fragment, edition, image-hash and perceptual-duplicate reviews remain pending",
        "leakage-resistant nonempty real train/dev/test partitions",
        "object, manuscript, fragment, side and exposure lineage is incomplete"
      ],
      "candidate_id": "TPOP-NECROPOLIS-5",
      "exact_public_source_metadata_match_count": 0,
      "image_equivalence_status": "NOT_TESTED",
      "nearby_collection_witness_count": 18,
      "overlap_state": "potential_overlap",
      "rights_status": "NOT_CLEARED",
      "source_lineage_status": "NO_DIRECT_METADATA_MATCH__ALIAS_IMAGE_EDITION_REVIEW_PENDING"
    },
    {
      "admission_status": "blocked",
      "blockers": [
        "R-017 covers pinned public metadata only; no direct string match does not establish independence",
        "R-017 identifies 18 nearby benchmark witnesses in this institutional collection",
        "all-source benchmark accession/edition/near-duplicate quarantine",
        "approved acquisition channel, actual image bytes, image hashes, faces and writing IDs",
        "candidate roster is metadata-only and does not grant use or acquisition permission",
        "diplomatic/transliteration/editorial-text rights are not verified",
        "exact institutional image bytes and original hash have not been verified",
        "independent expert line/sign/transliteration gold and uncertainty",
        "independent expert-reviewed line/sign gold is unavailable",
        "independent rights and intended use for each actual image and editorial text/annotation",
        "institutional alias, joined-fragment, edition, image-hash and perceptual-duplicate reviews remain pending",
        "leakage-resistant nonempty real train/dev/test partitions",
        "object, manuscript, fragment, side and exposure lineage is incomplete"
      ],
      "candidate_id": "TPOP-1880",
      "exact_public_source_metadata_match_count": 0,
      "image_equivalence_status": "NOT_TESTED",
      "nearby_collection_witness_count": 18,
      "overlap_state": "potential_overlap",
      "rights_status": "NOT_CLEARED",
      "source_lineage_status": "NO_DIRECT_METADATA_MATCH__ALIAS_IMAGE_EDITION_REVIEW_PENDING"
    },
    {
      "admission_status": "blocked",
      "blockers": [
        "R-017 covers pinned public metadata only; no direct string match does not establish independence",
        "R-017 identifies 12 nearby benchmark witnesses in this institutional collection",
        "all-source benchmark accession/edition/near-duplicate quarantine",